product_name,product_manufacturer,product_mrp,type,quickViewDesc
EUREKA FORBES Stick Vac NXT 550W Dry Vacuum Cleaner with Cyclonic Technology (Easy Dust Disposal, Orange & Black),Eureka Forbes,7999,Wet & Dry Vacuum Cleaners,Type: Dry Vacuum Cleaner | Form Factor: Upright, Handheld, Stick | Suction Power: 13 kPa | Power Consumption: 550 Watt | Filter Type: Bagless Filter, HEPA Filter | Dust Tank Capacity: 0.5 Litres | 2-in-1 Usage, Multi Usage Cleaning, Lightweight & Compact Design | 1 Year Product Warranty
HITACHI iZen 3400SXL Convertible 1.5 Ton 3 Star Inverter Split AC with Penta Sensor (Copper Condenser, RAS.G318PCC2SS1),Hitachi,58800,Inverter ACs,1.5 Ton Inverter AC, 3 Star Rating | Copper Condenser | 1 Year Comprehensive Warranty | For Rooms up to 180 sqft | Power Consumption: 1013.01 W | Refrigerant: R32 | Ice Clean, Silent Air, Filter Clean Indicator
HAVELLS Falcon 1100 Watts Handheld Garment Steamer (100ml Water Tank, Dry Heat Protection, Blue),Havells,3975,Garment Steamers,Water Tank Capacity: 100ml | Power: 1100 Watts | Operation Type: Handheld | Steam Rate: 22 g/min | Warranty: 2 Years Warranty
Haier HRF-3182I 268 Litres 2 Star Frost Free Double Door Convertible Refrigerator with Turbo Icing Technology (HRF-3182IBNS-P, Nickel Steel),Haier,41490,Double Door Refrigerators,268 Litres, 2 Star Rating | No. of Doors: 2 | Ideal for 3 Family Size | Easy Slide Shelf, Premium Flat Door Asthetics with Chrome Strip, Stabilizer Free Operation | 2 Years Warranty on Product
Croma 1600W Dry Vacuum Cleaner with AutoCord Winder (2025 model,High Efficiency Cyclone System, Grey),Croma,10000,Dry Vacuum Cleaners,Type: Dry Vacuum Cleaner | Form Factor: Canister | Suction Power: 29.92 kPa | Power Consumption: 1600 Watt | Filter Type: HEPA Filter | Dust Tank Capacity: 1.5 Litres | Fixed Cord, Speed Levels: Automatic, Edge Cleaning | 2 Year Product Warranty
EUREKA FORBES AP 150 Air Purifier with Surround 360 Degree Air Intake Technology (3 Stage Filtration, White),Forbes,9000,Air Purifiers,Type: Air Purifier | Coverage Area: 200sqft | Filter Type: HEPA Filter, Pre Filter, Activated Carbon Filter | Clean Air Delivery Rate (CADR): 150 cu.m/hr | Power Consumption: 25 Watt | 3 Level Fan Speed, Filter Change Indicator, Silent Operation | 1 Year Product Warranty
LG 9.5 kg 5 Star Semi Automatic Washing Machine with Roller Jet Pulsator (P955ASGAZ.ADGQEIL, Dark Grey),LG,23490,Top Load Washing Machines,9.5 kg, Top Load, Semi Automatic | 5 Star Rating | Ideal For 8-10 Members | 3 Wash Programs | Collar Scrubber, Rust Free Plastic Base, Rat Away Technology | 24 Months Warranty on Product, 10 Years Warranty on Motor
HAVELLS Libeccio 5 Star 1200mm 4 Blade BLDC Motor Ceiling Fan with Remote (Inverter Technology, Slate),Havells,12415,Ceiling Fans,Sweep Size: 1200mm | Power Consumption: 40 Watt, 5 Star Rating | Speed Settings: 5 | RPM: 260 | Air Flow Volume: 14700 m3/hr | BLDC Motor, Aerodynamic Winglet Blades, Dust Resistant | 2 Years Product Warranty
SAMSUNG 7 kg Inverter Fully Automatic Top Load Washing Machine (WA70A4002GS/TL, Diamond Drum, Imperial Silver),Samsung,19800,Top Load Washing Machines,7kg, Top Load, Inverter Fully Automatic | Ideal for 6-8 Family Size | 6 Wash Programsâ | Center Jet Technology, Eco Tub Clean, Magic Filter | 24 Months Warranty, 2 Years Motor Warranty
AO Smith MiniBot 3 Litres 5 Star Vertical Instant Water Geyser with Glass Coated (Black),A. O. Smith,5340,Instant Water Heaters,3 Litres, Instant Water Geyser | Heat Source: Electricity | Ideal For: Bathroom | Kitchen | Operation Type: Automatic | Wall Mount, Vertical | 8 bars Water Pressure, Power: 4500 Watts
SAMSUNG Bespoke 467 Litres 2 Star Frost Free Double Door Smart Wifi Enabled Refrigerator with AI Energy Mode (RT80F51C2FHL, Black Doi),Samsung,74999,Double Door Refrigerators,467 Litres, 2 Star Rating | Digital Inverter Compressor | No. of Doors: 2 | Ideal for 4-6 Family Size | Twin Cooling Plus, Convertible 5-in-1, SmartThings Home Care | 1 Year Warranty on Product, 20 Years Compressor Warranty
Haier Vogue Series 598 Litres 3 Star Frost Free Side by Side Refrigerator with Expert Inverter Technology (HRT-683GOG, Grey Onyx Glass),Haier,149290,3 Star Refrigerators,598 Litres, 3 Star Rating | Inverter Compressor | No. of Doors: 3 | Ideal for Large Family Size | Deo Fresh Technology, Digital Control Panel, 83% Convertible Fridge Space | 1 Year Warranty on Product, 10 Years Compressor Warranty
VOLTAS Aqua Prime 25 Litre 4 Star Vertical Storage Geyser with Quartzline Technology (White & Silver),Voltas,14790,Storage Water Heaters,25 Litre, Storage Geyser | Ideal for: Bathroom | Mount Type: Vertical | Power Consumption: 2000 W | Maximum Operating Pressure: 8 Bars | Adjustable Thermostat Knob: Yes | Quartzline Technology, 4 Star Rated, 6 Level Safety | 2 Years Product Warranty, 7 Years Warranty in Inner Tank
Crompton Surebreeze 34 Litres Tower Air Cooler with Overload Protection (4 Way Air Deflection, White & Black),Crompton,10500,Tower Air Coolers,Type: Tower Air Cooler | Tank Capacity: 34 Litres | Coverage Area: 160sqft | Air Flow: 1147.72 Cubic Feet Per Minute | Air Throw: 16 Feet | Power Consumption: 190 Watt | Cooling Pad: Honeycomb | Ice Chamber, Everlast Pump, Auto Fill | 1 Year Product Warranty
Crompton Mountair New 6 Inch 150mm Exhaust Fan (Silent Operation, White),Crompton,1999,Exhaust Fans,Sweep Size: 150mm | Duct Size: 150mm | Power Consumption: 24 Watt | RPM: 1800 | Superior Air Flow, Lightweight & Sleek Design, Rust-Free ABS Body | 2 Years Product Warranty
SAMSUNG Stylish Grande 183 Litres3 Star Direct Cool Single Door Refrigerator with Anti Bacterial Gasket (RR20C1723S8/HL, Elegant Inox),Samsung,18999,Single Door Refrigerators,183 Litres, 3 Star Rating | Digital Inverter Compressor | No. of Doors: 1 | Ideal for 1-2 Family Size | Stabilizer Free Operation, Clear View Lamp, Fresh room | 1 Year Warranty on Product, 20 Years Compressor Warranty
Sunflame Flair 750 Watts Dry Iron (Automatic Temperature Control, Black & Red),Sunflame,1095,Dry Irons,Power: 750 Watts | Type of Soleplate: Non-Stick Soleplate | USP: 360 Degree Swivel, Power On Indicator | Warranty: 2 Years Warranty
GM Wave 1000 Watts D 1000 Watts Dry Iron (Thermostat Fuse, Black),GM,1490,Dry Irons,Power: 1000 Watts | Type of Soleplate: Non-Stick Soleplate | USP: Dual LED Indicator, Temperature Regulating knob | Warranty: 2 Years Warranty
O GENERAL BMA Series 1.1 Ton 3 Star Split AC (Copper Condense, ASGA14BMAA-B),O General,43180,Split ACs,1.1 Ton AC, 3 Star Rating | Copper Condenser | 1 Year Comprehensive Warranty | For Rooms up to 130 sqft | Power Consumption: 1020 W | Refrigerant: R32 | Blue Fin Evaporator, Smart Diagnosis
Croma 60 Litres Desert Air Cooler with Inverter Compatible (Evaporative Cooling Technology, White & Black),Croma,14500,Desert Air Coolers,Type: Desert Air Cooler | Tank Capacity: 60 Litres | Coverage Area: 500sqft | Air Flow: 2472.02 Cubic Feet Per Minute | Air Throw: 40 Feet | Power Consumption: 190 Watt | Cooling Pad: Honeycomb | 4 Way Air Circulation, Auto Fill Tank, Ice Chamber | 1 Year Product Warranty
LG 201 Litres 3 Star Direct Cool Single Door Refrigerator with Antibacterial Gasket (GL-B211HPZD.APZZEB, Shiny Steel),LG,21199,Single Door Refrigerators,201 Litres, 3 Star Rating | Conventional Compressor | No. of Doors: 1 | Ideal for Family of 3 Members | Stylish Door Lock, Sleek Design, Works Without Stabilizer | 1 Year Warranty on Product, 10 Years Compressor Warranty
acer 7.5 kg 5 Star Fully Automatic Top Load Washing Machine (Halo Wash, AR75FATLP1GT, AiSense, Grey),Acer,35999,Top Load Washing Machines,7.5kg, Top Load, Fully Automatic | BEE 4 Star Rating | Ideal for 6-8 Family Size | 10 Wash Programs | 24 Months Warranty, 10 Years Motor Warranty
Xiaomi S10 Robotic Vacuum Cleaner & Mop with Wi-Fi Connectivity (Advanced Laser Navigation, Black),Xiaomi,34999,Robotic Vacuum Cleaners,Type: Smart Robotic Vacuum Cleaner | Functions: Vacuum & Mop | Suction Power: 4 kPa | Battery Capacity: 3200 mAh | Run Time: Upto 140 mins | High-Precision Sensors, Smart App Control, 2-in-1 Water Tank & Dust Container | 1 Year Product Warranty
SANSUI Arctic Pro 5 in 1 Convertible 1.4 Ton 3 Star Inverter Split AC with Anti Virus Protection (Copper Condenser, JSP183SICFB1),Sansui,54990,Inverter ACs,1.4 Ton Inverter AC, 3 Star Rating | Copper Condenser | 1 Year Comprehensive Warranty, 10 Years Compressor Warranty, 5 Years PCB Warranty | For Rooms up to 170 sqft | Power Consumption: 4800 W | Refrigerant: R32 | Zen Cool Inverter Technology, Anti-Rust Nano Coating, Self Diagnosis
USHA Mist Air Flo 400mm 3 Blade Copper Motor Pedestal Fan (Aerodynamically Design, Light Blue),Usha,3490,Pedestal Fans,Sweep Size: 400mm | Power Consumption: 55 Watt | Speed Settings: 3 | RPM: 1350 | Air Flow Volume: 4200 m3/hr | Corrosion Protection, Thermal Overload Protector, Inverter Technology | 2 Years Product Warranty
GM Maestro 400mm 3 Blade 360 Degree Oscillation Pedestal Fan with Remote (Rust Resistant, White),GM,16000,Pedestal Fans,Sweep Size: 400mm | Power Consumption: 65 Watt | Speed Settings: 3 | RPM: 1200 | Air Flow Volume: 3600 m3/hr | Quiet Operation, Off Timer, Energy Saving | 25 Months Product Warranty
Panasonic XN 1.5 Ton 4 Star Fixed Speed Window AC (Copper Condenser, PM 0.1 Filter, CW-XN184AM),Panasonic,44490,Window ACs,1.5 Ton Fixed Speed AC, 4 Star Rating | Copper Condenser | 1 Year Comprehensive Warranty, 5 Years Compressor Warranty | For Rooms up to 170 sqft | Power Consumption: 1510 W | Refrigerant: R32 | Temperature Sensors, Conquer Heat
DREAME R10 Pro 425W Cordless Dry Vacuum Cleaner with LED Light (150 Air Watts Suction, Black),DREAME,139999,Cordless Vacuum Cleaners,Type: Dry Vacuum Cleaner | Form Factor: Stick | Suction Power: 20 kPa | Power Consumption: 425 Watt | Filter Type: HEPA | Dust Tank Capacity: 0.6 Litres | Five Layer Filtration, Multi Surface Brush, Brushless Motor | 1 Year Product Warranty
Crompton Mountair New 6 Inch 150mm Exhaust Fan (Silent Operation, Wooden),Crompton,2199,Exhaust Fans,Sweep Size: 150mm | Duct Size: 150mm | Power Consumption: 24 Watt | RPM: 1800 | Superior Air Flow, Lightweight & Sleek Design, Rust-Free ABS Body | 2 Years Product Warranty
LG 592 Litres 1 Star Frost Free Double Door Refrigerator with Smart Inverter Compressor (GR-H812HLHM, Platinum Silver),LG,103999,Double Door Refrigerators,592 Litres, 1 Star Rating | Smart Inverter Compressor | No. of Doors: 2 | Ideal for Large Family | Door Cooling Technology, R-600A Refrigerant | 1 Year Warranty on Product, 10 Years Compressor Warranty
BAJAJ MX-35N 2000 Watts 210ml Steam Iron (Vertical & Horizontal Ironing, Black),Bajaj,3800,Steam Irons,Power: 2000 Watts | Type of Soleplate: Non-Stick Soleplate | Water Tank Capacity: 210ml | USP: Anti-Drip and Anti-Scale Technology, Thermal Fuse | Warranty: 2 Years Warranty
HAVELLS Instanio Prime 3 Litre Vertical Instant Geyser with Feroglas Technology (White & Blue),Havells,7290,Instant Water Heaters,3 Litre, Instant Geyser | Ideal for: Bathroom | Mount Type: Vertical | Power Conusmption: 3000 W | Maximum Operating Pressure: 8 Bars | Adjustable Thermostat Knob: No | Color Changing LED Indicator, High Precision Thermostat & Cutout, IPX4 Water Resistance & Splash Proof | 2 Years Product Warranty, 7 Years Warranty in Inner Tank, 3 Years Warranty in Heating Element
BAJAJ Shield Verre Plus 5 Litre Vertical Instant Geyser with Multiple Safety System (White & Gray),Bajaj,9500,Instant Water Heaters,5 Litre, Instant Geyser | Ideal for: Kitchen | Mount Type: Vertical | Power Consumption: 3000 W | Maximum Operating Pressure: 6 Bars | Adjustable Thermostat Knob: No | Rust Proof, LED Indicator, DuraCoat Non-Stick Heating Element | 4 Years Product Warranty, 5 Years Warranty in Tank, 6 Years Warranty in Heating Element
Premier 4KVA Excel Voltage Stabilizer For 1.5T Air Conditioner (185 - 265 V, Digital Display, 169915, White),Premier,2440,Voltage Stabilizers,Ideal For: Air Conditioner | Load Capacity: Up to 1.5 Ton Air Conditioner | 0 | Protection Type: Overload Protection | Enhance Durability & Reliability | 60 Months Warranty
SAMSUNG 7 Kg 5 Star Wi-Fi Inverter Fully Automatic Top Load Washing Machine (WA70BG4582BYTL, Ecobubble Technology, Lavender Grey),Samsung,28500,Top Load Washing Machines,7kg, Top Load, Inverter Fully Automatic | BEE 5 Star Rating | Ideal for 6-8 Family Size | 14 Wash Program | Eco Bubble, Tempered Glass Window | 24 Months Warranty
Crompton Versa Hz RHS 25 Litre 3 Star Horizontal Storage Geyser with Powerful Heating Element (White),Crompton,13900,Storage Water Heaters,25 Litre, Storage Geyser | Ideal for: Bathroom | Mount Type: Horizontal | Power Consumption: 2000W | Maximum Operating Pressure: 8 Bars | Adjustable Thermostat Knob: Yes | Rust Proof Plastic Body, 3 Level Safety, Superior Glassline Coating | 2 Years Product Warranty, 7 Years Warranty in Inner Tank, 3 Years Warranty on Heating Element
Symphony HiFlo 27 Litres Room Air Cooler with i-Pure Technology (Cool Flow Dispenser, Grey),Symphony,8499,Portable Air Coolers,Type: Room Air Cooler | Tank Capacity: 27 Litres | Coverage Area: 170sqft | Air Flow: 2700 Cubic Feet Per Minute | Air Throw: 33 Feet | Power Consumption: 150 Watt | Cooling Pad: Honeycomb | Whisper-Quiet Operation, Water Level Indicator, 360 Degree Castor Wheels | 1 Year Product Warranty
tp-link Tapo C210 Pan/Tilt Wi-Fi CCTV Security Camera (Privacy Mode, White),Tp-Link,4499,CCTV Video Security,Device Function: Alarm | Record | Storage | Motion Sensor | Ideal For: Private Space | Pan and Tilt, High-Definition Video, Local Storage | Storage Capacity: Up to 512 GB | Advanced Night Vision | 24 Months Warranty
Haier 7.5 kg 5 Star Fully Automatic Top Load Washing Machine (Heater 688, HWM75-H688S8, In-built Heater, Dark Jade),Haier,40000,Top Load Washing Machines,7.5kg, Top Load, Fully Automatic | BEE 5 Star Rating | Ideal for 3-4 Family Size | Soft Closing, Pillow Drum, Toughened Glass | 5 Years Warranty, 12 Years Motor Warranty
Agni solar Inflatable Light 2s Solar LED Light (Water Proof, AG-LANC, White),Agni Solar,2909,Solar Lights,Product Type: Solar LED Light | Ideal For: Home | Outdoor | Installation Type: Freestanding | Table Top | Power Source: Battery Powered | Solar Powered | 7 Distinct Color Modes | Waterproof (IP67) up to 1 meter
Yale Smart Locks For Private Space (Smart Keypad, YDME 100 NxT, Black),Yale,26499,Smart Locks,Functions: Intrusion Alarm | Alarm | Ideal For: Private Space | Fingerprint Scanner | Voice Guidance | 2 x RFID Cards | 2 x Mechanical Keys | Warranty: 36 Months
Blue Star P Series 1.5 Ton 3 Star Fixed Speed Window AC (Copper Condenser, WFD318P),Blue Star,39500,Window ACs,1.5 Ton Fixed Speed AC, 3 Star Rating | Copper Condenser | 1 Year Comprehensive Warranty, 5 Years Compressor Warranty | For Rooms up to 170 sqft | Power Consumption: 1525 W | Refrigerant: R32 | Self Diagnosis, Anti-Corrosive Blue Fins for Protection
Whirlpool 9 kg 5 Star Inverter Fully Automatic Front Load Washing Machine (XPERT CARE OZONE, XO9012BYV53E, In-built Heater, Volcano Grey),Whirlpool,54300,Front Load Washing Machines,9kg, Front Load, Inverter Fully Automatic | BEE 5 Star Rating | Ideal for 4-6 Family Size | 15 Wash Programs | 6th Sense Soft Move Technology | Steam Wash Technology, Ozone Air Refresh Technology | 36 Months Warranty
Croma 0.75 Ton 3 Star Window AC (Copper Condenser, Dust Filter),Croma,36000,Window ACs,0.75 Ton Window AC, 3 Star Rating | Copper Condenser | 1 Year Comprehensive Warranty, 5 Years Compressor Warranty | For Rooms up to 80 sqft | Power Consumption: 836 W | Refrigerant: R32 | Blue Fins Coating
HAVELLS Husky 2200 Watts 320ml Steam Iron (Steam & Spray Burst, Purple),Havells,4499,Steam Irons,Power: 2200 Watts | Type of Soleplate: Ceramic Non-stick Coating Soleplate | Water Tank Capacity: 320ml | USP: Self Cleaning, Anti Scale System | Warranty: 2 Years Warranty
SAMSUNG 256 Litres 3 Star Frost Free Double Door Convertible Refrigerator with Stabilizer Free Operation (RT30C3733BX/HL, Luxe Black),Samsung,44990,3 Star Refrigerators,256 Litres, 3 Star Rating | Digital Inverter Compressor | No. of Doors: 2 | Ideal for Family of 3 Members | Auto Defrostation, Digital Display Control Panel, Moist Fresh Zone | 1 Year Warranty on Product, 20 Years Compressor Warranty
Haier 11/7 kg 5 Star Wi-Fi Fully Automatic Front Load Washer Dryer (HWD110-DM14959CS8U1, AI-Dynamic Balance Tech, Dark Jade),Haier,89990,Washer Dryer Combo,11/7kg, Wi-Fi, Front Load, Fully Automatic | BEE 5 Star Rating | Ideal for 4-6 Family Size | 12 Wash Programs | AI-Dynamic Balance Technology | 60 Months Warranty, 20 Years Motor Warranty
SAMSUNG 8 kg 5 Star Semi Automatic Washing Machine with Magic Filter (WT80C4200GG/TL, Dark Grey),Samsung,16900,Semi Automatic Washing Machines,8Kg, Top Load, Semi Automatic | BEE 5 Star Rating | Ideal for 6-8 Family Size | 4 Wash Programs | Hexa Storm Pulsator, Dual Magic Filter, Air Turbo Drying | 24 Months Warranty, 5 Years Motor Warranty
Croma 7 in 1 Convertible 1.5 Ton 3 Star Inverter Split AC with Temperature Sensor (2025 Model, Copper Condenser, CRLA018IND170286),Croma,41400,Inverter ACs,1.5 Ton Inverter AC, 3 Star Rating | Copper Condenser | 1 Year Comprehensive Warranty, 10 Years Compressor Warranty, 5 Years PCB Warranty | For Rooms up to 180 sqft | Power Consumption: 1690 W | Refrigerant: R32 | Auto Restart, PM 2.5 Filter, Self Diagnosis
Juvo Wireless Door and Window Alarm (HSB02, White),Juvo,1490,Other Security Systems,Functions: Alarm Alerts | Ideal For: Private Space | Extremely Loud 120 dB Siren | Password Protected | Low Battery Indicator Light | 6 Months Warranty
PHILIPS EasySpeed 14 1440 Watts 180ml Steam Iron (Quick Heat-up, Blue),Philips,2295,Steam Irons,Power: 1440 Watts | Type of Soleplate: Linished Soleplate | Water Tank Capacity: 180ml | USP: Self Cleaning, Variable Steam | Warranty: 2 Years Warranty
Croma 2000W Fan Room Heater with 2 Heating Modes (Adjustable Thermostat, Black & Grey),Croma,3200,Fan Room Heaters,Type: Fan Room Heater | Power Consumption: 2000 W | Heating Modes: 2 | Over Heat Protection: Yes | Compact Design, Turbo Fan Blower, ISI Certified | 1 Year Warranty
LG 8 kg 5 Star Fully Automatic Top Load Washing Machine (THD08SJM, AI Direct Drive, Middle Black),LG,35990,Top Load Washing Machines,8kg, Top Load, Fully Automatic | BEE 5 Star Rating | Ideal for 3-4 Family Size | 6 Wash Programs | In-built Heater, Smart Diagnosis, 6 Motion DD | 24 Months Warranty, 10 Years Motor Warranty
LG 11 kg 5 Star Inverter Fully Automatic Top Load Washing Machine (THD11SWM.ABMQEIL, AI Direct Drive, Middle Black),LG,41990,Top Load Washing Machines,11 kg, Top Load, Fully Automatic | 5 Star Rating | Ideal For 8-10 Members | 8 Wash Programs | Turbo Wash Technology, Hygienic Clothes with Steam Technology | 24 Months Warranty on Product, 10 Years Warranty on Motor
KENSTAR Pulse HC 20 Litres Personal Air Cooler with Double Ball Bearing Motor (Collapsible Louvres, White),Kenstar,7990,Portable Air Coolers,Type: Personal Air Cooler | Tank Capacity: 20 Litres | Coverage Area: 215.27sqft | Air Flow: 353.14 Cubic Feet Per Minute | Air Throw: 35.08 Feet | Power Consumption: 80 Watt | Cooling Pad: Honeycomb | Ice Chamber, Castor Wheels, Water Level Indicator | 1 Year Product Warranty
Croma 7 in 1 Convertible 2 Ton 3 Star Inverter Split AC with Temperature Sensor (2025 Model, Copper Condenser, CRLA024IND283270),Croma,54000,Inverter ACs,2 Ton Inverter AC, 3 Star Rating | Copper Condenser | 1 Year Comprehensive Warranty, 10 Years Compressor Warranty, 5 Years PCB Warranty | For Rooms up to 260 sqft | Power Consumption: 2020 W | Refrigerant: R32 | Antivirus Protection, Self Diagnosis, Auto Restart
Haier 445 Litres 2 Star Frost Free Double Door Bottom Mount Convertible Refrigerator with Triple Inverter Technology (HRB-4952CKG-P, Black Glass),Haier,87490,Bottom Freezer Refrigerators,445 Litres, 2 Star Rating | Inverter Compressor | No. of Doors: 2 | Ideal for 4-6 Family Size | 14 in 1 Convertible Mode, 1 Hour Icing Technology, Connects Home Inverter | 2 Years Warranty on Product, 10 Years Compressor Warranty
DREAME Mova K10 Pro 220W Cordless Wet & Dry Vacuum Cleaner with Smart Dirt Detection (LED Display, White),DREAME,229999,Cordless Vacuum Cleaners,Type: Wet & Dry Vacuum Cleaner | Form Factor: Stick | Suction Power: 15 kPa | Power Consumption: 220 Watt | Filter Type: HEPA | Dust Tank Capacity: 0.6 Litres | Turbo Mode, Enhanced Edge Cleaning, One Press Self Cleaning | 1 Year Product Warranty
SAMSUNG 7 kg 5 Star Inverter Fully Automatic Front Load Washing Machine (WW70T502NTW/TL, Diamond Drum, White),Samsung,37900,Front Load Washing Machines,7kg, Front Load, Inverter Fully Automatic | BEE 5 Star Rating | Ideal for 6-8 Family Size | 21 Wash Programs | Hygiene Steam Technology, AI & Wi-Fi Support | 24 Months Warranty, 20 years warranty on the DIT Motor
Haier Clean Cool Plus 7 in 1 Convertible 1 Ton 3 Star Triple Inverter Plus Split AC with Anti Dust Filter (Copper Condenser, HSU13C-TQS3BN-INV),Haier,53400,Inverter ACs,1 Ton Triple Inverter Plus AC, 3 Star Rating | Copper Condenser | 5 Years Comprehensive Warranty, 12 Years Warranty on Compressor | For Rooms up to 130 sqft | Power Consumption: 1155 W | Refrigerant: R32 | Supersonic Cooling in 10 Sec, Frost Self Clean, Intelli Adjust
KENSTAR Fresh 10 Litres 3 Star Horizontal Storage Water Geyser with Built-in Thermostat (White/Grey),Kenstar,10590,Storage Water Heaters,10 Litres, Storage Water Geyser | Heat Source: Electricity | Ideal Usage: Bathroom | Operation Type: Automatic | Wall Mount, Horizontal | 8 bars Water Pressure, Power: 2000 Watts
iGear Electric Powered 5 Watt Desk Study Lamp (iG-U2, Black),IGear,3000,Table Lamps,Product Type: Desk Light | Ideal For: Home | Installation Type: Table Top | Portable | Power Source: Electric Powered | Rated Wattage: 5 Watts | 6 Months Warranty
AGARO Ace 1600W Wet & Dry Vacuum Cleaner with Blower Function (2-in-1, Black),Agaro,9999,Wet & Dry Vacuum Cleaners,Type: Wet & Dry Vacuum Cleaner | Form Factor: Canister | Suction Power: 21.5 kPa | Power Consumption: 1600 Watt | Filter Type: HEPA Filter | Dust Tank Capacity: 21 Litres | 360 Degree Swivel Wheel, 5 Stage Filtration Process, Large Sized Capacity | 1 Year Product Warranty
DesignNest Heng Balance 5 Watts LED Table Lamp (249 Lumens, 20000 Hours Life Span, DH0075WT/HBLEUC, White),Design Nest,3559,Table Lamps,Product Type: Table Lamp | Ideal For: Home | USB Powered | Installation Type: Table Top | Portable | Power Source: Battery Powered | Electric Powered | Rated Wattage: 5 Watts | 24 Months Warranty
IFB 7 kg 5 Star Wi-Fi Inverter Fully Automatic Front Load Washing Machine (Serena MBN 7012K, AI Technology, Mocha),IFB,40290,Front Load Washing Machines,7kg, Wi-Fi, Front Load, Inverter Fully Automatic | BEE 5 Star Rating | Ideal for 3-4 Family Size | 11 Wash Programs | 3D Wash System Technology | Aqua Energie, Auto Restart, Steam Refresh | 48 Months Warranty, 10 Years Motor Warranty
Peng Essentials Ironing Board (Heat Resistant, Floral_3-Leg_L3, Multicolor),Peng Essentials,2099,Garment Care Accessories,Ironing Board | Sturdy & Durable | Silicone Stoppers | 12 Months Warranty
Origin OM1 Wardrobe, Study, Food Storage Cabinet, Safe & Car Mini Dehumidifier with Reduces Humidity (Compact & Cute Design, White),Origin,2500,Air Dehumidifiers,Type: Mini Air Dehumidifier | Coverage Area: 5.28sqft | Draining Capacity: 0.03 litres per day | Tank Capacity: 0.2 litres | Power Consumption: 68 Watt | Non-toxic, Non-dissolvable & Non-liquid Produced, SiO2 Desiccant Material, 3 Hrs Regeneration Time | 1 Year Product Warranty
AO Smith 15 Litres 3 Star Horizontal Storage Water Geyser with Glass Coated Incoloy Heating Element (White),A. O. Smith,11700,Storage Water Heaters,15 Liters, Storage Water Geyser | Heat Source: Electricity | Ideal For: Bathroom | Operation Type: Automatic | Wall Mount, Horizontal | 8 Bars Water Pressure, Power: 2000 Watts
Symphony Diet 12T 12 Litres Personal Air Cooler with i-Pure Technology (Cool Flow Dispenser, White),Symphony,7499,Portable Air Coolers,Type: Personal Air Cooler | Tank Capacity: 12 Litres | Coverage Area: 130sqft | Air Throw: 30 Feet | Power Consumption: 165 Watt | Cooling Pad: Honeycomb | Water Level Indicator, Low Power Consumption, 360 Degree Castor Wheels | 1 Year Product Warranty
UNISTAB US100DF 3 Amps Voltage Stabilizer For Up to 600 L Refrigerator (130 - 270 V, Advance Overheat Protection, Grey),UNISTAB,4122,Voltage Stabilizers,Ideal For: Refrigerator | Load Capacity: For Up to 600 L Refrigerator | Capacity: 3 Amps | Protection Type: Overheat Protection | Segment Digital Display, Wall Mount | 36 Months Warranty
SAMSUNG 650 Litres Frost Free French Door Convertible Refrigerator with Triple Cooling (RF65DB90BD12/TL, Clean White),Samsung,244000,Side By Side Refrigerators,650 Litres | Digital Inverter Compressor | No. of Doors: 4 | Ideal for Large Family Size | Flex Zone, AI Energy Mode, 5 Convertible Modes | 1 Year Warranty on Product, 20 Years Compressor Warranty
Haier Revive 7 in 1 Convertible 1.5 Ton 3 Star Triple Plus Inverter Split AC with Antimicrobial Protection ( Copper Condenser, HSU18R-NTB3BE-INV),Haier,61200,Inverter ACs,1.5 Ton Triple Inverter Plus AC, 3 Star Rating | Copper Condenser | 1 Year Comprehensive Warranty, 12 Years Compressor Warranty | For Rooms up to 180 sqft | Power Consumption: 1695 W | Refrigerant: R32 | Supersonic Cooling, Long Air Throw, Frost Self Clean
Crompton Energion Roverr 5 Star 1200mm 3 Blade BLDC Motor Ceiling Fan with Remote (Anti Dust, Champagne Gold),Crompton,12399,Ceiling Fans,Sweep Size: 1200mm | Power Consumption: 37 Watt, 5 Star Rating | Speed Settings: 5 | RPM: 360 | Air Flow Volume: 14700 m3/hr | BLDC Motor, Sleep Timer Enabled, Intelligent Memory Function | 5 Years Product Warranty
