product_name,product_manufacturer,product_mrp,type,quickViewDesc
HAVELLS Sprint LED 400mm 3 Blade High Speed Pedestal Fan (LED Indicator, Blue),Havells,4940,Pedestal Fans,Sweep Size: 400mm | Power Consumption: 50 Watt | Speed Settings: 3 | RPM: 1360 | Air Flow Volume: 4320 m3/hr | LED Indicator Lights, Heavy and Stable Base, Superior Low Voltage Performance | 2 Years Product Warranty
Blue Star G Series 3 Ton 1 Star Tower AC (3 Phase Advantage, Copper Condenser, VC136GBTUR3),Blue Star,115000,Tower ACs,3 Ton Inverter AC, 1 Star Rating | Copper Condenser | 1 Year Comprehensive Warranty, 1 Year Compressor Warranty | For Rooms up to 360 sqft | Power Consumption: 3700 W | Refrigerant: R32 | Turbo Cool, Smart Detect Technology, Comfort Sleep
Haier Kinouchi 7 in 1 Convertible 1.6 Ton 5 Star Hexa Inverter Split AC with Supersonic Cooling (2025 Model, Copper Condenser, HSU19K-PYSC5BN-INV),Haier,79000,Inverter ACs,1.6 Ton Hexa Inverter AC, 5 Star Rating | Copper Condenser | 5 Years Comprehensive Warranty, 12 Years Compressor Warranty | For Rooms up to 190 sqft | Power Consumption: 1395 W | Refrigerant: R32 | Frost Self Clean, Long Air Throw, Hyper PCB
Crompton Solarium Qube IOT 15 Litre 5 Star Vertical Smart Geyser with Alexa & Google Assistant Compatibility (White),Crompton,17000,Storage Water Heaters,15 Litre, Storage Geyser | Ideal for: Bathroom | Mount Type: Vertical | Power Consumption: 2000 W | Maximum Operating Pressure: 8 Bars | Rustproof, Easy Control with Alexa and Google Assistant, Advanced 3 Level Safety | 2 Years Product Warranty, 7 Years Warranty in Inner Tank
Crompton Solarium Neo 6 Litres 4 Star Vertical Storage Water Geyser with Glass Coated Incoloy Heating Element (White),Crompton,9000,Storage Water Heaters,06 Litres, Storage Water Geyser | Heat Source: Electricity | Ideal For: Bathroom | Kitchen | Operation Type: Automatic | Wall Mount, Vertical | 8 bars Water Pressure, Power: 2000 Watts
IFB Silver Star 8 in 1 Convertible 2 Ton 3 Star Inverter Split Smart AC with Wi-Fi Supported (Copper Condenser, CI223SS32RGN1),IFB,80490,Inverter ACs,2 Ton Inverter AC, 3 Star Rating | Copper Condenser | 1 Year Comprehensive Warranty, 10 Years Compressor Warranty | For Rooms up to 260 sqft | Power Consumption: 2035 W | Refrigerant: R32 | Dual Goldfin, AI Powered, Filter Clean Indicator
GM Orca 1100 Watts Dry Iron (360 Degree Swivel Cord, Red),GM,1590,Dry Irons,Power: 1100 Watts | Type of Soleplate: Non-Stick Soleplate | USP: Shock Proof Iron Box, Double ISI, Neon Indicator | Warranty: 2 Years Warranty
Yale 20.5 Litres Digital Safety Locker (1 Shelve, YSEB/250/EB1, Black),Yale,26299,Electronic Safes,Functions: Smart Security | Ideal For: Private Space | Commercial Space | 20.5 Litres Storage Capacity | Internal Hooks | Automatic Door Opening | 12 Months Warranty
Honeywell Air Touch V4 Air Purifier with Remote Control (Advanced 5 Stage Filtration, White),Honeywell,19299,Air Purifiers,Type: Air Purifier | Coverage Area: 543sqft | Filter Type: Anti Bacterial Filter, Silver Ion Filter, HEPA Filter, Cold Catalyst Filter, Activated Carbon Filter | Clean Air Delivery Rate (CADR): 350 cu.m/hr | Power Consumption: 40 Watt | 3 Air Purifying Speeds, UV LED Technology, PM2.5 Level Indicator | 2 Years Product Warranty
Orient Primus 3 Litres Instant Geyser with 5 Level Safety Shield (White),Orient,5190,Instant Water Heaters,3 Litre, Instant Geyser | Ideal for: Kitchen | Mount Type: Vertical | Power Consumption: 3000 W | Maximum Operating Pressure: 8 Bars | Adjustable Thermostat Knob: No | Shock Proof, LED Indicator, Stainless Steel Tank | 2 Years Product Warranty, 5 Years Warranty on Tank, 2 Years Warranty on Heating Element
USHA Racer Chrome 1 Star 1200mm 3 Blade Copper Motor Ceiling Fan (High Lift Angle of Blade, Smoke Brown),Usha,3390,Ceiling Fans,Sweep Size: 1200mm | Power Consumption: 50 Watt, 1 Star Rating |  | RPM: 400 | Air Flow Volume: 12600 m3/hr | Copper Motor, High Lift Angle of Blade, Beautiful Chrome Rings | 2 Years Product Warranty
MR BEAMS Electric Powered 1 Watt Motion Sensor Smart Light (MB312, Black),Mr Beams,4500,Smart Lightings,Product Type: Motion Sensor Smart Light | Ideal For: Home | Commercial | Installation Type: Wall Mount | Power Source: Battery Powered | Rated Wattage: 1 Watts | Luminous Flux: 80 Lumens
HAVELLS Enticer 5 Star 1200mm 3 Blade BLDC Motor Ceiling Fan with Remote (Dust Resistant, Pearl White Chrome),Havells,7935,Ceiling Fans,Sweep Size: 1200mm | Power Consumption: 35 Watt, 5 Star Rating | Speed Settings: 5 | RPM: 390 | Air Flow Volume: 14100 m3/hr | BLDC Motor, Double Ball Bearing, Memory Function | 2 Years Product Warranty
atomberg Efficio Plus 6 Inch 150mm Exhaust Fan with BLDC Motor (Silent Operation, Umber Brown),Atomberg,3360,Exhaust Fans,Sweep Size: 150mm | Duct Size: 147mm | Power Consumption: 5 Watt | RPM: 1400 | Double Ball Bearing, 100% Pure Copper Motor, Energy Efficient | 2 Years Product Warranty
V-Guard 15 Amps Voltage Stabilizer For 2T Air Conditioner (135 - 280 V, Fail Safe Circuit Protection, VWI 500, White),V-Guard,6990,Voltage Stabilizers,Ideal For: Air Conditioner | Load Capacity: Up to 2 Ton Inverter Air Conditioner | Capacity: 15 Amps | Protection Type: Overload Protection | Over Voltage Protection | Microcontrolled operations | 36 Months Warranty
Blue Star A Series 2.5 Ton 3 Star Inverter Split AC ( Copper Condenser, Dust Filter, IM330AANU1),Blue Star,78300,Inverter ACs,2.5 Ton Inverter AC, 3 Star Rating | Copper Condenser | 1 Year Comprehensive Warranty, 5 Years Compressor Warranty | For Rooms up to 310 sqft | Power Consumption: 2755 Watts | Refrigerant: R32 | Dust Filter, Self Diagnosis, Turbo Cool
Origin Novita ND 328 Home & Office Dehumidifier with Semi-Permanent Built-in Ionizer (Digital Display, White),Novita,39900,Air Dehumidifiers,Type: Dehumidifier | Coverage Area: 230.52sqft | Draining Capacity: 20 litres per day | Tank Capacity: 4 litres | Power Consumption: 355 Watt | Child Lock Function, Auto Resume, Programmable Timer | 1 Year Product Warranty
Yale Digital Lock (Built-in Bluetooth, YSSB/BL, Black),Yale,20999,Smart Safe,Functions: Smart Security | Storage | Ideal For: Private Space | Commercial Space | Access by PIN code | Access by Yale Home App | Anti-drill, Anti-pick Plate | 12 Months Warranty
Russell Hobbs Steam Genie Essential 1600 Watts Handheld Garment Steamer (200ml Water Tank, Steam Trigger Lock, Green),Russell Hobbs,6395,Garment Steamers,Water Tank Capacity: 200ml | Power: 1600 Watts | Operation Type: Handheld | Steam Rate: 22 g/min | Warranty: 2 Years Warranty
BAJAJ EDGE HS Neo EE Deco 1 Star 1200mm 3 Blade Copper Motor Ceiling Fan (Energy Efficient, Bianco),Bajaj,3720,Ceiling Fans,Sweep Size: 1200mm | Power Consumption: 52 Watt, 1 Star Rating | Speed Settings: 3 | RPM: 400 | Air Flow Volume: 12600 m3/hr | High Torque, Low Power Consumption, Decorative Trims | 2 Years Product Warranty
Russell Hobbs ROR12F 2900W Oil Filled Radiator Room Heater with 12 Fins (Anti Tilt Protection,Russell Hobbs,22995,Oil Filled Radiator (OFR) Room Heater,Type: Oil Filled Radiator Room Heater | Power Consumption: 2900 W | Heating Modes: 2 | Over Heat Protection: Yes | Adjustable Heat Settings
Whirlpool 7.5 kg Fully Automatic Top Load Washing Machine (WhiteMagic Premier, 31599, Spiro Wash Action, Grey),Whirlpool,21100,Top Load Washing Machines,7.5kg, Top Load, Fully Automatic | Ideal for 6-8 Family Size | 12 Wash Programs | Floor Standing, Rat Mesh | 24 Months Warranty, 10 Years Motor Warranty
Trueview Mini 4G CCTV Security Camera (Area Motion Detection, T18120, White),Trueview,13800,CCTV Video Security,Device Function: Motion Sensor | Storage | Alarm | Photo Capture | Record | Ideal For: Public Space | Private Space | Commercial Space | Area Motion Detection, Humanoid Detection, Push Alarm Information, 10X Digital Zoom, Cloud Recording | Storage Capacity: Support Micro SD Card Up to 256GB and Cloud Storage (Optional) | Power: 5 Watts | 24 Months Warranty
SHARP Room Air Dehumidifier with PlasmaCluster Ion Technology (Child Lock, White),Sharp,30000,Air Dehumidifiers,Type: Air Dehumidifier | Coverage Area: 248Sqft | Draining Capacity: 10 litres per day | Tank Capacity: 2.5 litres | Power Consumption: 230 Watt | Plasmacluster Technology, Auto-Dry Function, Pre-Filter for Hygiene | 1 Year Warranty
Racold Omnis DG 10 Litres 5 Star Vertical Storage Water Geyser with Built-in Thermostat (Sandstorm Gold),Racold,18299,Storage Water Heaters,10 Litres, Storage Water Geyser | Heat Source: Electricity | Ideal For: Bathroom | Operation Type: Automatic | Wall Mount, Vertical | 8 bars Water Pressure, Power: 2000 Watts
HAVELLS Magnatron 15 Litre 4 Star Vertical Storage Geyser with Revolutionary Induction Heat Transfer Technology (White & Blue),Havells,26490,Storage Water Heaters,15 Litre, Storage Geyser | Ideal for: Bathroom | Mount Type: Vertical | Power Consumption: 2000 W | Maximum Operating Pressure: 8 Bars | Adjustable Thermostat Knob: Yes | Digital Temperature Display, Whirl Flow Technology, Corrosion Resistant | 2 Year Product Warranty, 7 Years Warranty in Inner Tank, 5 Years Warranty in Induction Coil
Crompton Silent Pro Blossom 5 Star 1200mm 3 Blade BLDC Motor Smart Ceiling Fan with Remote (Alexa & Google Assistant, Brown),Crompton,16999,Ceiling Fans,Sweep Size: 1200mm | Power Consumption: 40 Watt, 5 Star Rating | Speed Settings: 5 | RPM: 300 | Air Flow Volume: 14700 m3/hr | BLDC Motor, Anti Dust, High Speed | 2 Years Product Warranty
Crompton Surebreeze Hillbriz Deco 1 Star 1200mm 3 Blade High Velocity Ceiling Fan (Inverter Technology, Smoked Brown),Crompton,3139,Ceiling Fans,Sweep Size: 1200mm | Power Consumption: 52 Watt, 1 Star Rating | Speed Settings: 5 | RPM: 400 | Air Flow Volume: 12600 m3/hr | Double Ball Bearing, Rust Free, Powder Coated | 5 Years Product Warranty
SAMSUNG 465 Litres 2 Star Frost Free Double Door Smart Wifi Enabled Refrigerator with AI Energy Mode (RT51DG682BB1TL, Black Matt),Samsung,69890,Double Door Refrigerators,465 Litres, 2 Star Rating | Digital Inverter Compressor | No. of Doors: 2 | Ideal for 4-6 Family Size | Convertible Freezer, Mono Cooling Technology, AI Energy Mode | 1 Year Warranty on Product, 20 Years Compressor Warranty
VOLTAS SAC 183VH Vectra Platina Convertible 1.5 Ton 3 Star Inverter Split AC with Self Diagnosis ( Copper Condenser),Voltas,69990,Inverter ACs,1.5 Ton Split Inverter AC, 3 Star Rating | Copper Condenser | 1 Year Comprehensive Warranty, 9 Warranty on Compressor | For Rooms up to 180 sq.ft | Power Consumption: 1640 Watts | Refrigerant: R32 | Stabilizer Free Operation, Anti Dust & Antimicrobial Protection, Ambient Temperature
Xiaomi 360 Home 2k Pro Security Camera (AI Human Detection, MJSXJ06CM, White),Xiaomi,5999,CCTV Video Security,Device Function: Record | Smart Security | Ideal For: Private Space | HD Resolution, Motion Sensor, 3 Million Pixels, 360-Degree Panorama, Full Colour in Low-Light, AI Human Detection | Storage Capacity: MicroSD card (up to 32 GB supported) | Power: 3.5 Watts | 6 Months Warranty
SR PORTABLES 1 Watt Solar Powered LED Light (140 Lumens, SRSOLLMP, Orange),SR Portables,3000,Solar Lights,Product Type: LED Light | Ideal For: Outdoor | Home | Installation Type: Portable | Freestanding | Power Source: Solar Powered | Rated Wattage: 1 Watt | Luminous Flux: 140 Lumens
VOLTAS 125V Vertis Elite Gold 1 Ton 5 Star Inverter Split AC with Ice Wash Technology (Copper Condenser, Anti Dust Filter, 4503682),Voltas,65990,Inverter ACs,1 Ton Inverter AC, 5 Star Rating | Copper Condenser | 1 Year Comprehensive Warranty, 10 Years Compressor Warranty | For Rooms up to 130 sqft | Power Consumption: 1050 W | Refrigerant: R32 | Super Silent Operation, Anti Microbial Filter, Sleep Mode
Racold Omnis Wi-Fi 25 Litres 5 Star Vertical Storage Water Geyser with Titanium Enameled Heating Element (Black/Grey),Racold,22849,Storage Water Heaters,25 Litres, Storage Water Geyser | Heat Source: Electricity | Ideal For: Bathroom | Operation Type: Automatic | Wall Mount, Vertical | 8 bars Water Pressure, Power: 2000 Watts
Racold Altro iRS 3 Litres Instant Water Geyser (3000 Watts, 3803285, Green),Racold,6099,Instant Water Heaters,3 Litres, Instant Water Geyser | Heat Source: Electricity | Ideal For: Bathroom | Operation Type: Automatic | Wall Mount, Vertical | 6.5 Bars Water Pressure, Power: 3000 Watts
V-Guard Pebble Metro 10 Litre 5 Star Vertical Storage Geyser with Energy Saving Technology (White),V-Guard,15920,Storage Water Heaters,10 Litre, Storage Geyser | Ideal for: Bathroom | Mount Type: Vertical | Power Consumption: 2000 W | Maximum Operating Pressure: 8 Bars | Adjustable Thermostat Knob: Yes | Multifunctional Safety Valve, Overheat Protection, PUF Insulation | 3 Years Product Warranty, 10 Years Warranty in Inner Tank, 4 Years Warranty in Heating Element
HAVELLS Elegance 1200 Watts Handheld Garment Steamer (150ml Water Tank, 2 Mode, Gold),Havells,7395,Garment Steamers,Water Tank Capacity: 150ml | Power: 1200 Watts | Operation Type: Handheld | Steam Rate: 25 g/min | Warranty: 2 Years Warranty
SAMSUNG 5 in 1 Convertible 1.5 Ton 5 Star Inverter Split Smart AC with AI Auto Cooling ( Copper Condenser, AR18CY5YAWK),Samsung,72990,Inverter ACs,1.5 Ton Inverter AC, 5 Star Rating | Copper Condenser | 1 Year Comprehensive Warranty, 10 Years Compressor Warranty | For Rooms up to 180 sqft | Power Consumption: 1260 W | Refrigerant: R32 | Copper Anti-bacterial Filter, SmartThings AI Energy Mode, Corrosion Resistant
BAJAJ Majesty RFX 2 2000W Fan Room Heater with Automatic Thermal Cutout (Adjustable Thermostat,Bajaj,3199,Fan Room Heaters,Type: Fan Room Heater | Power Consumption: 2000 W | Heating Modes: 2 | Over Heat Protection: Yes | Cool Touch Housing
Crompton Solarium Neo 25 Litre 5 Star Vertical Storage Geyser with Anti Siphon Protection (Ivory),Crompton,14500,Storage Water Heaters,25 Litre, Storage Geyser | Ideal for: Bathroom | Mount Type: Vertical | Power Consumption: 2000 W | Maximum Operating Pressure: 10 Bars | Adjustable Thermostat Knob: Yes | Advanced 4 level Safety, Powerful Heating Element, Smart LED Indicator | 2 Years Product Warranty, 7 Years Warranty in Tank, 3 Years Warranty in Heating Element
Yale Doorbell Chime (Adjustable Volume, SV-VDBCH-1A-W, White),Yale,2699,Other Security Systems,Functions: Real Time Alerts | Video Capture | Smart Security | Ideal For: Private Space | 2W Speaker | 7 Different Sounds | Multi-house Support | 6 Months Warranty
Crompton Surebreeze Sea Sapphira 1 Star 1200mm 3 Blade High Velocity Ceiling Fan (Double Ball Bearing, Ivory),Crompton,2599,Fans,Sweep Size: 1200mm | Power Consumption: 52 Watt, 1 Star Rating | Speed Settings: 5 | RPM: 380 | Air Flow Volume: 12000 m3/hr | Superior Air Delivery, High Speed, Powder Coated | 2 Years Product Warranty
V-Guard Pebble Metro 25 Litre 5 Star Vertical Storage Geyser with Energy Saving Technology (White),V-Guard,21260,Storage Water Heaters,25 Litre, Storage Geyser | Ideal for: Bathroom | Mount Type: Vertical | Power Consumption: 2000 W | Maximum Operating Pressure: 8 Bars | Adjustable Thermostat Knob: Yes | Multifunctional Safety Valve, Overheat Protection, PUF Insulation | 3 Years Product Warranty, 10 Years Warranty in Inner Tank, 4 Years Warranty in Heating Element
PHILIPS HI114 1000 Watts Dry Iron (Iron Temperature-ready Light, White),Philips,1295,Dry Irons,Power: 1000 Watts | Type of Soleplate: Golden American Heritage Soleplate | USP: Thermostatic Controller | Warranty: 2 Years Warranty
Symphony Diet 50T 50 Litres Tower Air Cooler with i-Pure Technology (Cool Flow Dispenser, White),Symphony,12999,Tower Air Coolers,Type: Tower Air Cooler | Tank Capacity: 50 Litres | Coverage Area: 172sqft | Air Throw: 40 Feet | Power Consumption: 165 Watt | Cooling Pad: Honeycomb | Powerful Blower, Water Level Indicator, 360 Degree Castor Wheels | 1 Year Product Warranty
Racold Omnis Lux Plus 10 Litres 5 Star Vertical Storage Water Geyser with Silver Ion Technology (White/Silver),Racold,16649,Storage Water Heaters,10 Litres, Storage Water Geyser | Heat Source: Electricity | Ideal Usage: Bathroom | Operation Type: Automatic | Wall Mount, Vertical | 8 bars Water Pressure, Power: 2000 Watts
BAJAJ Compagno 6 Litre 5 Star Vertical Storage Geyser with Swirl Flow Technology (White & Blue),Bajaj,10500,Storage Water Heaters,6 Litre, Storage Geyser | Ideal for: Bathroom | Mount Type: Vertical | Power Consumption: 2000 W | Maximum Operating Pressure: 8 Bars | Adjustable Thermostat Knob: Yes | Titanium Armour Technology, Child Safety Mode, Multifunction Valve | 2 Years Product Warranty, 7 Years Warranty in Inner Tank & 3 Years Warranty in Heating Element
Origin Novita ND 25.5 Dehumidifier & Air Purifier with Semi-Permanent Built-in Ionizer (Digital Display, White),Origin,54400,Air Dehumidifiers,Type: Dehumidifier & Air Purifier | Coverage Area: 230.52sqft | Filter Type: Pre-Mesh Filter, Carbon Filter, HEPA Filter | Clean Air Delivery Rate (CADR): 230 cu.m/hr | Power Consumption: 370 Watt | Auto Resume, 5 Step Purification, Programmable Timer | 1 Year Product Warranty
Orient Tornado II 450mm 3 Blade High Speed Wall Mounted Fan (Inverter Technology, Black),Orient,5545,Wall Mount Fans,Sweep Size: 450 mm | Power Consumption: 90 Watt | Speed Settings: 3 | RPM: 1325 | Air Flow Volume: 6600 m3/hr | Thermal Overload Protector, Auto Reset Function, Ring Resist Corrosion | 2 Years Product Warranty
HAVELLS Efficiencia Neo 5 Star 1200mm 3 Blade BLDC Motor Ceiling Fan with Remote (High Speed, Brown),Havells,5980,Ceiling Fans,Sweep Size: 1200mm | Power Consumption: 26 Watt, 5 Star Rating | Speed Settings: 5 | RPM: 350 | Air Flow Volume: 13200 m3/hr | BLDC Motor, Energy Saving, Low Noise | 2 Years Product Warranty
BAJAJ Shield Crest Plus 25 Litre 5 Star Vertical Storage Geyser with Swirlflow Technology (White & Grey),Bajaj,16010,Storage Water Heaters,25 Litre, Storage Geyser | Ideal for: Bathroom | Mount Type: Vertical | Power Consumption: 2000 W | Maximum Operating Pressure: 8 Bars | Adjustable Thermostat Knob: Yes | Surge Protection, Child Safety Mode, Duracoat Non-Stick Heating Element | 4 Years Product Warranty, 10 Years Warranty in Tank, 6 Years Warranty in Heating Element
DesignNest Heng Balance 5 Watts LED Table Lamp (249 Lumens, 20000 Hours Life Span, DH0075RD/HBLEUC, Red),Design Nest,3559,Table Lamps,Product Type: Table Lamp | Ideal For: Home | USB Powered | Installation Type: Table Top | Portable | Power Source: Battery Powered | Electric Powered | Rated Wattage: 5 Watts | 24 Months Warranty
HAVELLS Zurii 60 Litres Tower Air Cooler with Dust Filter Net (Low Water Alarm, Black & Grey),Havells,23790,Tower Air Coolers,Type: Tower Air Cooler | Tank Capacity: 60 Litres | Coverage Area: 136sqft | Air Flow: 735.72 Cubic Feet Per Minute | Air Throw: 20 Feet | Cooling Pad: Honeycomb | Easy Operation with Remote & Electronic Panel, Auto Swing System, 3 Speed Settings | 1 Year Product Warranty
BAJAJ Grace Neo BBD EE 1 Star 1200mm 3 Blade Anti Corrosive Ceiling Fan (Energy Efficient, Moonlight White),Bajaj,4335,Ceiling Fans,Sweep Size: 1200mm | Power Consumption: 52 Watt, 1 Star Rating | RPM: 370 | Air Flow Volume: 12600 m3/hr | High Speed, Wider Blades, Easy to Clean | 2 Years Product Warranty
USHA COOLBOY MINI 18 Litres Personal Air Cooler with Inverter Compatible (Thermal Overload Protection, White),Usha,8190,Portable Air Coolers,Type: Personal Air Cooler | Tank Capacity: 18 Litres | Coverage Area: 107.63sqft | Air Flow: 529.72 Cubic Feet Per Minute | Air Throw: 8.2 Feet | Power Consumption: 80 Watt | Cooling Pad: Honeycomb | Ultra Durable Concealed Pump, Water Level Indicator, Ice Chamber | 1 Year Product Warranty
HAVELLS Inox 5 Star 1200mm 3 Blade BLDC Motor Ceiling Fan with Remote (Dust Resistant, Pearl White),Havells,12050,Ceiling Fans,Sweep Size: 1200mm | Power Consumption: 38 Watt, 5 Star Rating | Speed Settings: 5 | RPM: 280 | Air Flow Volume: 14700 m3/hr | BLDC Motor, Upto 8 Hours Timer Settings, Aerodynamic Blade Design | 2 Years Product Warranty
Racold CDR DLX 10 Litre 3 Star Horizontal Storage Geyser with Titanium Plus Technology (White & Grey Dome),Racold,10749,Storage Water Heaters,10 Litre, Storage Geyser | Ideal for: Bathroom | Mount Type: Horizontal | Power Consumption: 2000 W | Maximum Operating Pressure: 8 Bars | Adjustable Thermostat Knob: No | Rust Proof Body, Safety Plus, Smart Guard | 2 Years Product Warranty, 5 Years Warranty in Inner Tank & 2 Years Warranty in Heating Element
HAVELLS Convertible 80 Litres Desert Air Cooler with Metal Blade Fan (Powerful Air Delivery, White & Grey),Havells,27490,Desert Air Coolers,Type: Desert Air Cooler | Tank Capacity: 80 Litres | Coverage Area: 409sqft | Air Flow: 2060.02 Cubic Feet Per Minute | Air Throw: 30 Feet | Cooling Pad: Honeycomb | Easy Operation with Remote and Electronic Panel, Auto Swing System, 3 Speed Settings | 1 Year Product Warranty
Qubo Smart Door Lock (Voice Assistant, OC-HLM01CU1, Copper),Qubo,35990,Door Security/Lock,Functions: Smart Security | Alarm | Alerts | Ideal For: Private Space | Permanent Access | Time Access | One Time Access | 2 RFID Access Card or Emergency Keys | Passcode | Mechanical Key | Fingerprint | Share Access via OTP, Register upto 100 Fingerprints | 24 Months Warranty
CP PLUS 7 inch Video Intercom Kit (Multiple Bell Sounds, CP-UVK-701MTA, White),CP PLUS,18100,Other Security Systems,Functions: Vedio Call | Record | Ideal For: Video Door Phone | In-Built Memory | Supports Digital Wide Dynamic Range (DWDR) | TFT Display | 24 Months Warranty
HAVELLS Bianca 10 Litre 5 Star Vertical Storage Geyser with Whirl Flow Technology (White & Blue),Havells,16990,Storage Water Heaters,10 Litre, Storage Geyser | Ideal for: Bathroom | Mount Type: Vertical | Power Consumption: 2000 W | Maximum Operating Pressure: 8 Bars | Adjustable Thermostat Knob: Yes | Feroglas Technology, Thermal Cut-Out, Shock Safe Plug | 2 Years Product Warranty, 7 Years Warranty in Inner Tank & 4 Years Warranty in Heating Element
USHA Lambda 5 Star 1200mm 3 Blade BLDC Motor Ceiling Fan with Remote (Dust & Oil Resistant, Terra Brown),Usha,8600,Ceiling Fans,Sweep Size: 1200mm | Power Consumption: 38 Watt, 5 Star Rating | Speed Settings: 5 | RPM: 315 | Air Flow Volume: 14400 m3/hr | BLDC Motor, Whisper Quiet Operation, Double Ball Bearing | 2 Years Product Warranty
Racold Altro i Plus 3 Litres Instant Water Geyser (3000 Watts, 3803273, White and Grey),Racold,6249,Instant Water Heaters,3 Litres, Instant Water Geyser | Heat Source: Electricity | Ideal For: Bathroom | Operation Type: Automatic | Wall Mount, Vertical | 6.5 bars Water Pressure, Power: 3000 Watts
LLOYD 5 in 1 Convertible 1 Ton 5 Star Inverter Split AC with PM 2.5 Filter (Copper Condenser, GLS12I5FWBEV),Lloyd,57990,Split ACs,1 Ton Inverter AC, 5 Star Rating | Copper Condenser | 1 Year Comprehensive Warranty, 10 Years Compressor Warranty | For Rooms up to 130 sqft | Power Consumption: 860 W | Refrigerant: R32 | Clean Filter Indication, Low Gas Detection, Turbo Cool
Origin Novita ND12.8 Wardrobe Bedroom, Living Room, Guest Rooms, Office Cabins & Labs Dehumidifier with Auto Shut Off Function (Built-in Ionizer, White),Novita,26800,Air Dehumidifiers,Type: Air Dehumidifier | Coverage Area: 184.20sqft | Draining Capacity: 13 litres per day | Tank Capacity: 2.3 litres | Power Consumption: 213 Watt | Silent Operation, Semi Air Purification, Switch Off Timer | 1 Year Product Warranty
acer Acerpure Pro 4 in 1 HEPA Filter Air Purifier (Smart Sensor, AP551-50W, White),Acer,21999,Air Purifiers,Approximate Coverage Area – 484 Sq.Ft (45 Sq.M) | HEPA Filter Technoloy | CADR - 324 m³/hr | Pre filter, HEPA Plus+ Filter , HEPA 13 Main Filter , Activated Carbon Filter | Dimensions - 23.5 x 23 x 57.6 cms | LCD Display/Touch Panel
HAVELLS Inox 5 Star 1200mm 3 Blade BLDC Motor Ceiling Fan with Remote (Inverter Technology, Slate),Havells,12050,Ceiling Fans,Sweep Size: 1200mm | Power Consumption: 40 Watt, 5 Star Rating | Speed Settings: 5 | RPM: 280 | Air Flow Volume: 14700 m3/hr | BLDC Motor, IOT Enabled Fan, Aerodynamically Design | 2 Years Product Warranty
O GENERAL Advanced Hyper Tropical 3 Ton 5 Star Inverter Split AC (Copper Condenser, PM 2.5 Filter, ASGG36CETB-B),O General,136840,Inverter ACs,3 Ton Inverter AC, 5 Star Rating | Copper Condenser | 1 Year Comprehensive Warranty | For Rooms up to 390 sqft | Power Consumption: 3590 W | Refrigerant: R32 | Automatic Airflow Adjustment, Corrosion Resistant ODU, Self Diagnosis
Crompton Surebreeze Hillbriz Deco 1 Star 1200mm 3 Blade High Velocity Ceiling Fan (Inverter Technology, White Bronze),Crompton,3139,Ceiling Fans,Sweep Size: 1200mm | Power Consumption: 52 Watt, 1 Star Rating | Speed Settings: 5 | RPM: 400 | Air Flow Volume: 12600 m3/hr | Double Ball Bearing, Rust Free, Powder Coated | 2 Years Product Warranty
SHARP DW-J20FM-W Dehumidifier & Air Purifier with Plasmacluster Technology (PM 2.5 Indicator, White),Sharp,40000,Air Purifiers,Type: Dehumidifier & Air Purifier | Coverage Area: 550sqft | Filter Type: HEPA Filter, Active Carbon Filter, Pre Filter | Clean Air Delivery Rate (CADR): 258 cu.m/hr | Power Consumption: 50 Watt | Laundry Mode, Anti-bacterial Self Cleaning System, Inverter Operation | 1 Year Product Warranty
MILAGROW 24 Watts Robotic Vacuum Cleaner (0.6 Litres Tank, Red Hawk-21, Red),Milagrow,31990,Robotic Vacuum Cleaners,Robotic Vacuum Cleaner | Suitable For: Dry and Wet Cleaning | Ideal For: Home/Office | NIDEC Brushless Motor | Triple Filter System, Bagless, Back Dust Tank, Suction Power: 1500 Pa | 12 Months Warranty, 5 Years Suction Motor Warranty
voltmi Aura Negative Ion Concentration Technology Air Purifier (3-Stage Air Filtration, PAP01, Black),Voltmi,6999,Air Purifiers,Approximate Coverage Area – 100 Sq.Ft (9.29 Sq.M) | Negative Ion Concentration Technology | CADR – 8.2 m³/hr, PM2.5 | True Hepa H13 Air Filter | Dimensions – 7.40 x 7.40 x 17.10 cms | One-key deodorization
