product_name,product_manufacturer,product_mrp,type,quickViewDesc
Croma Bracket For Air Conditioner (Powder Coating Process, Grey),Croma,1199,Air Conditioner Accessories,Compatible With: 1 and 1.5 Ton ACs | Wall Mount | 12 Months Warranty
wipro 9 Watts Electric Powered LED Bulb (Voice Assistant Supported, NS9400, White),Wipro,2099,LED Bulbs,Product Type: LED Bulb | Ideal For: Home | Commercial | Installation Type: Wall Mount | Power Source: Electric Powered | Rated Wattage: 9 Watts | Music Sync Function, WiFi Support
BAJAJ Majesty DX 6 1000 Watts Dry Iron (German Coating Technology, White),Bajaj,920,Dry Irons,Power: 1000 Watts | Type of Soleplate: DuraGlide Soleplate | USP: Double Layer Non-stick Coating, Adjustable Temperature Setting, 360 Degree Swivel Cord | Warranty: 2 Years Warranty
Orient Fabrismooth 1000 Watts Dry Iron (Temperature Control, White),Orient,1040,Dry Irons,Power: 1000 Watts | Type of Soleplate: Non-Stick Soleplate | USP: G Shape Heating Element, 360 Degree Swivel Cord, Auto Cut Off | Warranty: 2 Years Warranty
Oakter OakRemote Universal Remote (360 Degree IP Coverage, White),Oakter,4590,Unknown,Ideal For: Television | Home Appliances | Voice Control | 2.4 GHZ WiFi Configuration | 12 Months Warranty | 
SafeStab 11 Amps Voltage Stabilizer For 1.5T Air Conditioner (150 - 270 V, Digital Display, VST400D, White),SafeStab,3400,Voltage Stabilizers,Ideal For: Air Conditioner | Load Capacity: Up to 1.5 Ton Air Conditioner | Capacity: 11 Amps | Protection Type: Surge Protection | Spike Protection | Toroidal Transformer Technology | 36 Months Warranty
Croma 6.5 kg 5 Star Semi Automatic Washing Machine with Built-in Soak Function (2025 Model, Burgundy),Croma,12000,Semi Automatic Washing Machines,6.5kg, Top Load, Semi Automatic | BEE 5 Star Rating | Ideal for 2-3 Family Size | 2 Wash Programs | Pulsator Technology | 24 Months Warranty, 5 Years Motor Warranty
Croma 7 in 1 Convertible 1.5 Ton 3 Star Inverter Split AC with Auto clean function (2025 Model, Copper Condenser, CRLA018IND283265),Croma,37500,Inverter ACs,1.5 Ton Inverter AC, 3 Star Rating | Copper Condenser | 1 Year Comprehensive Warranty, 10 Years Compressor Warranty, 5 Years PCB Warranty | For Rooms up to 180 sqft | Power Consumption: 1575 W | Refrigerant: R32 | Antivirus Protection, Self Diagnosis, Auto Restart
Croma 7.5 kg 5 Star Fully Automatic Top Load Washing Machine ( Fuzzy Control, Grey),Croma,24000,Top Load Washing Machines,7.5kg, Top Load, Fully Automatic | BEE 5 Star Rating | Ideal for 6-8 Family Size | 10 Wash Programs | Advanced Anti-Tangle Technology, Pulsator Wash, Air Dry Function | 24 Months Warranty, 10 Years Motor Warranty
Croma 1600 Watts 210ml Steam Iron (2025 Model, 360 Degree Swivel Cord, Brown),Croma,2000,Steam Irons,Power: 1600 Watts | Type of Soleplate: Non-Stick Teflon Coated Soleplate | Water Tank Capacity: 210ml | USP: 5 Modes, Overheat Safety, Temperature Control | Warranty: 1 Year Warranty
V-Guard 12 Amps Voltage Stabilizer For 1.5T Air Conditioner (170 - 270 V, Smart Digital Display, VG 400, Grey),V-Guard,2750,Voltage Stabilizers,Ideal For: Air Conditioner | Load Capacity: Up to 1.5 Ton or 18000 BTU/Hour | Capacity: 12 Amps | Protection Type: Overload Protection | Fuse Protection | Over Current Protecction | Generator Compatible | 36 Months Warranty
Crompton Surebreeze Hill Briz 1 Star 1200mm 3 Blade Copper Motor Ceiling Fan (Inverter Compatibility, Brown),Crompton,2599,Ceiling Fans,Sweep Size: 1200mm | Power Consumption: 52 Watt, 1 Star Rating | Speed Settings: 3 | RPM: 370 | Air Flow Volume: 12300 m3/hr | Double Ball Bearing, High Speed, Efficient Cooling | 2 Years Product Warranty
Crompton Surebreeze Hill Briz 1 Star 1200mm 3 Blade Copper Motor Ceiling Fan (High Velocity, Ivory),Crompton,2599,Ceiling Fans,Sweep Size: 1200mm | Power Consumption: 52 Watt, 1 Star Rating | Speed Settings: 3 | RPM: 390 | Air Flow Volume: 12600 m3/hr | Double Ball Bearing, Lightweight, Powder Coated | 2 Years Product Warranty
DAIKIN Premium Series 1.5 Ton 3 Star Inverter Split Smart AC with Dew Clean Technology (Copper Condenser, ATKL50UV16V/U/V3),Daikin,53830,Inverter ACs,1.5 Ton Inverter AC, 3 Star Rating | Copper Condenser | 1 Year Comprehensive Warranty, 10 Years Compressor Warranty, 5 Years PCB Warranty | For Rooms up to 180 sqft | Power Consumption: 1840 W | Refrigerant: R32 | Econo Mode, Anti Corrosion Treatment, 7 Hepta Sense
Croma 6.5 kg 5 Star Fully Automatic Top Load Washing Machine (CRLW065FAF264504, Lint Filter, Inox Grey),Croma,20000,Top Load Washing Machines,6.5kg, Top Load, Fully Automatic | BEE 5 Star Rating | Ideal for 2-3 Family Size | 8 Wash Programs | Pulsator Technology | Steel Inner Drum, Child lock, Auto Restart Function | 24 Months Warranty, 10 Years Motor Warranty
Croma 7 in 1 Convertible 1 Ton 3 Star Inverter Split AC with Temperature Sensor (2025 Model, Copper Condenser, CRLA012IND283264),Croma,33300,Inverter ACs,1 Ton Inverter AC, 3 Star Rating | Copper Condenser | 1 Year Comprehensive Warranty, 10 Years Compressor Warranty, 5 Years PCB Warranty | For Rooms up to 130 sqft | Power Consumption: 1060 W | Refrigerant: R32 | Anti Viral Dust Filter, Self Clean, Auto Restart
Crompton Energion Hyperjet 5 Star 1200mm 3 Blade BLDC Motor Ceiling Fan with Remote (Anti rust, Brown),Crompton,4849,Ceiling Fans,Sweep Size: 1200mm | Power Consumption: 35 Watt, 5 Star Rating | Speed Settings: 5 | RPM: 340 | Air Flow Volume: 13200 m3/hr | BLDC Motor, Aerodynamically Designed Blades, Sleep-Timer Enabled | 2 Years Product Warranty
 Blue Star P SERIES 1.5 Ton 3 Star Fixed Speed Window AC (2025 Model, Copper Condenser, WFE318P),Blue Star,36400,Window ACs,1.5 Ton Inverter AC, 3 Star Rating | Copper Condenser | 1 Year Comprehensive Warranty, 5 Years Warranty on Compressor | For Rooms up to 170 sqft | Power Consumption: 1540 W | Refrigerant: R32 | Energy Saver, Self Diagnosis, Auto Restart with Memory
VOLTAS 183V Vectra Platina 4 in 1 Convertible 1.5 Ton 3 Star Inverter Split AC with Anti Microbial Air FIlteration (Copper Condenser, 4503448),Voltas,59790,Split ACs,1.5 Ton Inverter AC, 3 Star Rating | Copper Condenser | 1 Year Comprehensive Warranty, 10 Years Compressor Warranty | For Rooms up to 180 sqft | Power Consumption: 1615 W | Refrigerant: R32 | High Ambient Cooling, Turbo Cooling, Multi Adjustable Mode
Croma 8 kg 5 Star Semi Automatic Washing Machine with Magic Filter (CRLW080SMF248602, Black),Croma,16000,Semi Automatic Washing Machines,8kg, Top Load, Semi Automatic | BEE 5 Star Rating | Ideal for 3-4 Family Size | 3 Wash Programs | Pulsator Washing Technology | Thermal Protector, IPX4 Rating Rust Free Body, Powerful Motor with Thermal Protector | 24 Months Warranty, 5 Years Motor Warranty
Croma 1400W Fan Room Heater with Adjustable Thermostat (Noiseless Operation,Croma,2100,Fan Room Heaters,Type: Fan Room Heater | Power Consumption: 1400 W | Heating Modes: 2 | Over Heat Protection: Yes | Efficient & Fast Heating
ILIFE V20 Robotic Vacuum Cleaner & Mop with Wi-Fi Connectivity (Alexa & Google Assistant, White),ILIFE,49999,Robotic Vacuum Cleaners,Type: Smart Robotic Vacuum Cleaner | Functions: Vacuum & Mop | Suction Power: 50 kPa | Water Tank Capacity: 250ml | Auto Carpet Boost, Auto Recharge & Resume, Room Selection Cleaning | 1 Year Product Warranty
Croma ECO 1200mm 3 Blade Copper Motor Ceiling Fan (Inverter Technology, Brown),Croma,2600,Ceiling Fans,Sweep Size: 1200mm | Power Consumption: 50 Watt | Speed Settings: 5 | RPM: 410 | Air Flow Volume: 12600 m3/hr | Seamless Ceiling Mount, Energy Efficient, Elegant Design | 2 Years Product Warranty
Crompton Surebreeze Hill Briz 1 Star 1200mm 3 Blade Copper Motor Ceiling Fan (Inverter Technology, Opal White),Crompton,2599,Ceiling Fans,Sweep Size: 1200mm | Power Consumption: 52 Watt, 1 Star Rating | Speed Settings: 5 | RPM: 390 | Air Flow Volume: 12600 m3/hr | Double Ball Bearing, High Speed, Powder Coated | 2 Years Product Warranty
Crompton Eris 1000 Watts Dry Iron (6 Fabric Settings, Yellow & Black),Crompton,1050,Irons,Power: 1000 Watts | Type of Soleplate: Weilburger Coated Non-Stick Soleplate | USP: 360-Swivel Cord, LED Indicators | Warranty: 2 Years Warranty
Croma 7 in 1 Convertible 0.8 Ton 3 Star Inverter Split AC with Temperature Sensor (2025 Model, Copper Condenser, CRLA009IND283263),Croma,32400,Inverter ACs,0.8 Ton Inverter AC, 3 Star Rating | Copper Condenser | 1 Year Comprehensive Warranty, 10 Years Compressor Warranty, 5 Years PCB Warranty | For Rooms up to 100 sqft | Power Consumption: 850 W | Refrigerant: R32 | Auto Restart, PM 2.5 Filter, Self Diagnosis
ILIFE T60s Robotic Vacuum Cleaner & Mop with Deep-Cleaning Suction Technology (6400 mAh Battery, White),ILIFE,199000,Robotic Vacuum Cleaners,Type: Smart Robotic Vacuum Cleaner | Functions: Vacuum & Mop | Battery Capacity: 6400 mAh | Water Tank Capacity: 100ml | Amazon Alexa, Google Home, Cutting-edge AI & LiDAR Technology | 1 Year Product Warranty
BAJAJ MX 3 Neo 1250 Watts 180ml Steam Iron (Auto Temperature Control Technology, Blue & White),Bajaj,2100,Steam Irons,Power: 1250 Watts | Type of Soleplate: Ceramic Coated Soleplate | Water Tank Capacity: 180ml | USP: Self Cleaning, 360-Degree Swivel Cord | Warranty: 2 Years Warranty
Croma 7 kg 5 Star Fully Automatic Top Load Washing Machine ( Spin Dry Function, Grey),Croma,22000,Top Load Washing Machines,7kg, Top Load, Fully Automatic | BEE 5 Star Rating | Ideal for 4-6 Family Size | 12 Wash Programs | Impeller Wash Technology, Pulsator Wash, Anti Bacterial Technology | 24 Months Warranty, 10 Years Motor Warranty
Croma 24 Wheel Trolley Stand for Washing Machine and Refrigerator ( Black),Croma,2499,Washer/Dryer Covers & Stands,Suitable For: Top Load Washing Machine | Refrigerator | Metallic Rod & Plastic Corners | Maximum Supported Capacity: 200 Kgs | 24 Wheels | Absorbs Vibrations | 12 Months Warranty
LG 6 in 1 Convertible 1.5 Ton 3 Star Dual Inverter Split AC with 6 Step Fan Speed (2025 Model, Copper Condenser, US-Q18RNXE.AMLG),LG,72990,Inverter ACs,1.5 Ton Dual Inverter AC, 3 Star Rating | Copper Condenser | 1 Year Comprehensive Warranty, 10 Years Compressor Warranty, 5 Years PCB & Motor Warranty | For Rooms up to 180 sqft | Power Consumption: 852.44 W | Refrigerant: R32 | Cools at 52 Degree Celsius, 2 Way Air Swing
Blue Star YNUS 5 in 1 Convertible 1.5 Ton 3 Star Inverter Split Smart AC with Turbo Cool (Copper Condenser, IC318YNUS),Blue Star,59200,Split ACs,1.5 Ton Inverter AC, 3 Star Rating | Copper Condenser | 1 Year Comprehensive Warranty, 10 Years Compressor Warranty, 5 Years PCB Warranty | For Rooms up to 180 sqft | Power Consumption: ?1685 W | Refrigerant: R32 | Dust Filter, Anti-Corrosive Protection, Stabilizer Free Operation
PHILIPS 5000 Series 1900W Cordless Dry Vacuum Cleaner with PowerCyclone 7 Technology (TriActive Nozzle, Magic Purple),Philips,14995,Dry Vacuum Cleaners,Type: Dry Vacuum Cleaner | Form Factor: Canister | Suction Power: 410 Watt | Power Consumption: 1900 Watt | Filter Type: Allergy H13 Filter, HEPA Filter | Dust Tank Capacity: 1.5 Litres | Power Control Function, Active Lock Tube Coupling, Easy-to-Empty Dust Tank | 2 Years Product Warranty
ILIFE A20 Pro Robotic Vacuum Cleaner & Mop with Wi-Fi Connectivity (Alexa & Google Assistant, Dove Gray),ILIFE,69999,Robotic Vacuum Cleaners,Type: Smart Robotic Vacuum Cleaner | Functions: Vacuum & Mop | Suction Power: 6500Pa | Battery Capacity: 5200 mAh | Run Time: Upto 260 mins | Water Tank Capacity: 200ml | Advanced LiDAR Navigation, Laser Detection System, Alexa Supported | 1 Year Product Warranty
Croma 183 Litres 2 Star Direct Cool Single Door Refrigerator with Anti-Fungal Door Gasket ( Rosalind Wine),Croma,16000,Single Door Refrigerators,183 Litres, 2 Star Rating | Reciprocating Compressor | No. of Doors: 1 | Ideal for Family of 1-2 Family Size | PCM Metal Finish Design, Stabilizer Free Operation, Direct Cooling Technology | 1 Year Warranty on Product, 5 Years Compressor Warranty
SANSUI Arctic Pro 5 in 1 Convertible 1.5 Ton 3 Star Inverter Split AC with PM 2.5 Filter (Copper Condenser, JSP183SI24A1),Sansui,58990,Inverter ACs,1.5 Ton Inverter AC, 3 Star Rating | Copper Condenser | 1 Year Comprehensive Warranty, 10 Years Compressor Warranty, 5 Years PCB Warranty | For Rooms up to 180 sqft | Power Consumption: 1011.43 kWh | Refrigerant: R32 | Auto Clean, Anti-Rust Nano Coating, Self Diagnosis
Crompton FabrimaX Plus 1250 Watts 200ml Steam Iron (6 Fabric Settings, Black & Blue),Crompton,1800,Steam Irons,Power: 1250 Watts | Type of Soleplate: Teflon Coating Soleplate | Water Tank Capacity: 200ml | USP: 360-Swivel Cord, Vertical and Horizontal Steam | Warranty: 2 Years Warranty
DAIKIN Premium Series 1.5 Ton 5 Star Inverter Split AC (Copper Condenser, PM 2.5 Filter, ATKM50UV16VA),Daikin,53830,Inverter ACs,1.5 Ton Inverter AC, 5 Star Rating | Copper Condenser | 1 Year Comprehensive Warranty, 10 Years Compressor Warranty | For Rooms up to 180 sqft | Power Consumption: ?1360 W | Refrigerant: R32 | Smart Diagnosis, Dew Clean Technology, Anti-Bacterial Coating
BAJAJ MX 45 2000 Watts 220ml Steam Iron (Anti Drip Technology, Black & Grey),Bajaj,3800,Steam Irons,Power: 2000 Watts | Type of Soleplate: Non-Stick German Technology Soleplate | Water Tank Capacity: 220ml | USP: Self Cleaning, Steam Burst | Warranty: 2 Years Warranty
Crompton Energion Hyperjet 5 Star 1200mm 3 Blade BLDC Motor Ceiling Fan with Remote (Hyper Mode, Opal White),Crompton,5499,Ceiling Fans,Sweep Size: 1200mm | Power Consumption: 35 Watt, 5 Star Rating | Speed Settings: 5 | RPM: 350 | Air Flow Volume: 13200 m3/hr | BLDC Motor, Aerodynamically Designed Blades, Time Enabled | 2 Years Product Warranty
Godrej T Series Convertible 1.4 Ton 3 Star Inverter Split AC with I-Sense Technology (Copper Condenser, 40101701SD01470),Godrej,40450,Inverter ACs,1.4 Ton Inverter AC, 3 Star Rating | Copper Condenser | 5 Years Comprehensive Warranty | For Rooms up to 170 sqft | Power Consumption: 906 W | Refrigerant: R32 | Anti-Freeze Thermostat, Silent Operation, Cools at 52°C
Carrier ESTER EDGE FXi 6 in 1 Convertible 1.5 Ton 5 Star Inverter Split Smart AC with Wi-Fi Supported (Copper Condenser, CAI19EE5R35W0),Carrier,76090,Inverter ACs,1.5 Ton Inverter AC, 5 Star Rating | Copper Condenser | 1 Year Warranty | For Rooms up to 180 sqft | Power Consumption: 1260 W | Refrigerant: R32 | Smart Energy Display, Intelligent CRF Alert, Google & Amazon Alexa Assistant (Optional)
Morphy Richards Super Glide 2000 Watts 350ml Steam Iron (Steam Burst, Blue),Morphy Richards,4910,Steam Irons,Power: 2000 Watts | Type of Soleplate: Ceramic Coated Soleplate | Water Tank Capacity: 350ml | USP: Anti-Calcium Function, Horizontal &Vertical Ironing | Warranty: 2 Years Warranty
SAMSUNG 7 kg 5 Star Fully Automatic Top Load Washing Machine (WA70BG4441BYTL, Diamond Drum, Lavender Gray),Samsung,22500,Top Load Washing Machines,7kg, Top Load, Inverter Fully Automatic | BEE 5 Star Rating | Ideal for 6-8 Family Size | 8 Wash Programs | BubbleStorm, Dual Storm, PP Dual Wing Pulsator | 24 Months Warranty, 20 Years Motor Warranty
Whirlpool 6.5 kg 5 Star Fully Automatic Top Load Washing Machine (Magic Clean, 31659, 6th Sense Technology, Grey),Whirlpool,18750,Top Load Washing Machines,6.5kg, Top Load, Fully Automatic | BEE 5 Star Rating | Ideal for 2-4 Family Size | 8 Wash Programs | Hard Water Wash, Spiro Wash Technology | Zero Pressure Fill Technology, Magic Lint Filter, Aqua Store | 24 Months Warranty, 5 Years Motor Prime & Mover Warranty
Croma 84 Litres 2 Star Direct Cool Single Door Refrigerator with Reversible Door ( Black),Croma,13000,Mini Refrigerators,84 Litres, 2 Star Rating | Reciprocating Compressor | No. of Doors: 1 | Ideal for Family of 1-2 Family Size | Direct Cool Cooling Technology, 3 Refrigeration Modes, Reversible Doors | 1 Year Warranty on Product, 1 Year Compressor Warranty
Whirlpool Protton 300 Litres Frost Free Triple Door Refrigerator with 6th Sense ActiveFresh Technology (20817, Alpha Steel),Whirlpool,39150,Triple Door Refrigerators,300 Litres | Reciprocating Compressor | No. of Doors: 3 | Ideal for 3 Family Size | Zeolite Technology, MicroBlock Technology, Moisture Retention Technology | 1 Year Warranty on Product, 10 Years Compressor Warranty
SAMSUNG Stylish Grande 183 Litres3 Star Direct Cool Single Door Refrigerator with Anti Bacterial Gasket (RR20C2Y23S8/HL, Elegant Inox),Samsung,19999,Single Door Refrigerators,183 Litres, 3 Star Rating | Digital Inverter Compressor | No. of Doors: 1 | Ideal for 1-2 Family Size | Stabilizer Free Operation, Toughened Glass, Clear View Lamp | 1 Year Warranty on Product, 20 Years Compressor Warranty
Yale Kyra Pro Smart Locks (Hidden Entry Code, Black),Yale,60999,Smart Locks,Functions: Lock | Ideal For: Private Space | RFID Key Tag | Hidden Entry Code | Anti-Panic Egress | 36 Months Warranty
CP PLUS 7 Inch Video Door Phone Kit (TFT LCD Display, CPPVK70TH, White),CP PLUS,11200,Other Security Systems,Functions: Video Call | Record | Ideal For: Video Door Phone | Color Settings Adjustments | Super Slim Hands-free Model | 7 inch Colour TFT-LCD Display | 24 Months Warranty
Crompton Energion Hyperjet 5 Star 1200mm 3 Blade BLDC Motor Ceiling Fan with Remote (Hyper Mode, Ivory),Crompton,5499,Ceiling Fans,Sweep Size: 1200mm | Power Consumption: 35 Watt, 5 Star Rating | Speed Settings: 5 | RPM: 340 | Air Flow Volume: 13200 m3/hr | BLDC Motor, Aerodynamically Designed Blades, Time Enabled | 24 Months Warranty
Whirlpool 7.5 kg 5 Star Fully Automatic Top Load Washing Machine (Whitemagic Elite, 31370, Lint Filter, Grey),Whirlpool,21200,Top Load Washing Machines,7.5kg, Top Load, Fully Automatic | BEE 5 Star Rating | Ideal for 6-8 Family Size | 12 Wash Programs | Power Scrub Technology, Spiro Wash, Hard Water Wash Technology | 24 Months Warranty, 10 Years Motor Warranty
SAMSUNG Horizontal Curve 189 Litres 5 Star Direct Cool Single Door Refrigerator with Anti Bacterial Gasket (RR21C2H25DX/HL, Luxe Brown),Samsung,23999,Single Door Refrigerators,189 Litres, 5 Star Rating | Digital Inverter Compressor | No. of Doors: 1 | Ideal for 1 - 2 Family Sizer | Stabilizer Free Operation, Base Stand Drawer, Garo Handle | 1 Year Warranty on Product, 20 Years Compressor Warranty
Croma 18 Litres Personal Air Cooler with Inverter Compatible (Anti Bacterial Honey Comb Pads, White, 2025 model),Croma,7500,Portable Air Coolers,Type: Personal Air Cooler | Tank Capacity: 18 Litres | Coverage Area: 160sqft | Air Flow: 676 Cubic Feet Per Minute | Air Throw: 18 Feet | Cooling Pad: Honeycomb | 3 Speed Control, Inverter Compatible, Cord Winding Station | 1 Year Product Warranty
Xiaomi 2i HD WiFi Dome CCTV Security Camera (AI Powered Motion Detection, MJSXJ10CM, White),Xiaomi,4499,CCTV Video Security,Device Function: Record | Smart Security | Ideal For: Private Space | Portable, Night Vision, Barking Detection, Cry Detection, Motion Sensor | Storage Capacity: MicroSD Card (Upto 32 GB Supported) | Power: 5 Watts | 6 Months Warranty
Blue Star Z Series 5 in 1 Convertible 1 Ton 5 Star Inverter Split Smart AC with Wi-Fi Supported (2025 Model, Copper Condenser, ID512ZNURS),Blue Star,59000,Inverter ACs,1 Ton Inverter AC, 5 Star Rating | Copper Condenser | 5 Years Comprehensive Warranty, 10 Years Compressor Warranty, 5 Years PCB Warranty | For Rooms up to 130 sqft | Power Consumption: 875 W | Refrigerant: R32 | AI Pro, Turbo Cool, Smart Scheduler
Croma 7 kg Fully Automatic Front Load Dryer (Fixed Frequency Motor, White),Croma,32000,Clothes Dryers,7kg, Front Load, Fully Automatic | Ideal for 6-8 Family Size | 16 Drying Programs | Drum Rotation, Steel Inner Drum, Fixed Frequency Motor | 24 Months Warranty, 10 Years Motor Warranty
Croma 1600 Watts 210ml Steam Iron (360 Degree Swivel Cord, Grey),Croma,2000,Steam Irons,Power: 1600 Watts | Type of Soleplate: Non-Stick Teflon Coated Soleplate | Water Tank Capacity: 210ml | USP: 5 Mode, Overheat Safety | Warranty: 1 Year Warranty
Crompton SilentPro Enso 5 Star 1200mm 3 Blade BLDC Motor Ceiling Fan with Remote (Inverter Technology, Silk White),Crompton,9830,Ceiling Fans,Sweep Size: 1200mm | Power Consumption: 42 Watt, 5 Star Rating | Speed Settings: 5 | RPM: 315 | Air Flow Volume: 14400 m3/hr | BLDC Motor, Multi-Pairing Function, Intelligent Memory Function | 5 Years Product Warranty
PHILIPS 3000 Series 1000 Watts Handheld Garment Steamer (100ml Water Tank, 1 Modes, Foldable, Reno Blue),Philips,4495,Garment Steamers,Water Tank Capacity: 100ml | Power: 1000 Watts | Operation Type: Handheld | Steam Rate: 20 g/min | Warranty: 2 Years Warranty
Whirlpool 7 Kg 5 Star Semi- Automatic Washing Machine with Soak Technology (Ace Supreme Pro, 30298, Wine),Whirlpool,14000,Semi Automatic Washing Machines,7kg, Top Load, Semi-Automatic | BEE 5 Star Rating | Ideal for 4-6 Family Size | 3 Wash Programs | Soak Technology | 48 Months Warranty
VOLTAS Vectra 4 in 1 Convertible 1.5 Ton 5 Star Inverter Split AC with Anti-Dust Filter (Copper Condenser, 185V Vectra Pearl Marvel),Voltas,69990,Split ACs,1.5 Ton Inverter AC, 5 Star | Copper Condenser | 1 Year Comprehensive Warranty, 10 Years Compressor Warranty | For Rooms up to 180 sqft | Power Consumption: 1270 Watts | Refrigerant: R32 | 4 in 1 Convertible, Antimicrobial Protection, 4 Step Adjustable Cooling
Whirlpool 6.5 kg 5 Star Semi Automatic Washing Machine with In built Scrubber (Magic Clean , 30337, Grey),Whirlpool,12500,Semi Automatic Washing Machines,6.5kg, Top Load, Semi Automatic | BEE 5 Star Rating | Ideal for 2-4 Family Size | Rat Protection, Multi Utility Tray, Max Dry Mode | 48 Months Warranty, 5 Years Warranty on Motor Prime & Mover
Blue Star Y Series 5 in 1 Convertible 1.5 Ton 3 Star Inverter Split AC with Self Diagnosis (Copper Condenser, ID318YKU),Blue Star,56400,Inverter ACs,1.5 Ton Inverter AC, 3 Star Rating | Copper Condenser | 1 Year Comprehensive Warranty, 10 Years Compressor Warranty, 5 Years PCB Warranty | For Rooms up to 180 sqft | Power Consumption: ?1730 W | Refrigerant: R32 | Inverter Rotary Compressor, Eco Mode, Turbo Cool
VOLTAS 163V Vectra Pearl 4 in 1 Convertible 1.3 Ton 3 Star Inverter Split AC with Anti Dust Filter ( Copper Condenser, 4503543),Voltas,59790,Split ACs,1.3 Ton Inverter AC, 3 Star Rating | Copper Condenser | 1 Year Comprehensive Warranty, 10 Years Compressor Warranty | For Rooms up to 150 sqft | Power Consumption: 1144 W | Refrigerant: R32 | Anti-Microbial Protection Filter, Turbo and Sleep Mode, Self Diagnosis
DREAME L10s Pro Ultra Robotic Vacuum Cleaner & Mop with Self Emptying (MopExtend Technology, White),DREAME,249999,Robotic Vacuum Cleaners,Type: Smart Robotic Vacuum Cleaner | Functions: Vacuum & Mop | Suction Power: 7 kPa | Battery Capacity: 5200 mAh | Run Time: Upto 220 mins | Water Tank Capacity: 80ml | Alexa Assistant Support, Auto Water Refilling, Dirt Detection | 1 Year Product Warranty
Croma 8 kg 5 Star Fully Automatic Top Load Washing Machine ( In Built heater, Inox Grey),Croma,32000,Top Load Washing Machines,8kg, Top Load, Fully Automatic | BEE 5 Star Rating | Ideal for 6-8 Family Size | 10 Wash Programs | Built-in Heater, Active Bubble Wash Technology, Child Lock | 24 Months Warranty, 10 Years Motor Warranty
Blue Star Y Series 5 in 1 Convertible 1 Ton 3 Star Inverter Split AC with Dust Filter (Copper Condenser, IE312YNU),Blue Star,47400,Inverter ACs,1 Ton Inverter AC, 3 Star Rating | Copper Condenser | 1 Year Comprehensive Warranty, 10 Years Compressor Warranty, 5 Years PCB Warranty | For Rooms up to 130 sqft | Power Consumption: 1140 W | Refrigerant: R32 | Smart Ready, Self Diagnosis, Turbo Cool
Croma CRSP3SPSPA264301 6 Amps 3 Way Multiplug (Built-in Surge Protection, White),Croma,400,Electric Plugs & MCBs,Ideal For: Mobile, Laptop, Television, Home Appliances, Home Theatres/Speaker System | LED Indicator | Capacity: 6 Amps | Protection Type: Surge Protection | Longer Durability | 12 Months Warranty
LG 8 kg 5 Star Inverter Fully Automatic Top Load Washing Machine (T80AJMB1Z.ABMQEIL, Stainless Steel Tub, Middle Black),LG,31490,Top Load Washing Machines,8 kg, Top Load, Fully Automatic | 5 Star Rating | Ideal For 6-8 Members | 8 Wash Programs | Smart Inverter, Spin Dry, Stainless Steel Tub | 24 Months Warranty on Product
Croma 9 Amps Voltage Stabilizer For 1.5T Air Conditioner (150 - 270 V, Thermal Overload Protection, CRLS150KAA297201, White),Croma,2900,Voltage Stabilizers,Ideal For: Air Conditioner | Load Capacity: Up to 1.5 Ton Air Conditioner | Capacity: 9 Amps | Protection Type: Overload Protection | Over Voltage Protection | Automatic Low & High Cut Off | 12 Months Warranty
Daikin Standard Series 0.8 Ton 3 Star Split AC (Copper Condenser, PM 2.5 Filter, FTL28U),Daikin,34470,Split ACs,0.8 Ton, 3 Star Rating | Copper Condenser | 1 Year Comprehensive Warranty, 5 Years Compressor Warranty | For Rooms up to 90 sqft | Power Consumption: 709 W | Refrigerant: R32 | Dust Filter, Self Diagnosis, Anti Corrosion Treatment
Carrier ESTER EDGE FXi 6 in 1 Convertible 1.5 Ton 3 Star Inverter Split Smart AC with Wi-Fi Supported (Copper Condenser, CAI18EE3R35W0),Carrier,68290,Inverter ACs,1.5 Ton Inverter AC, 3 Star Rating | Copper Condenser | 12 Months Warranty | For Rooms up to 180 sqft | Power Consumption: 1560 W | Refrigerant: R32 | Smart Energy Display, Intelligent CRF Alert, Google & Amazon Alexa Assistant (Optional)
Carrier ESTER EDGE FXi 6 in 1 Convertible 2 Ton 5 Star Inverter Split Smart AC with Wi-Fi Supported (2025 Model, Copper Condenser, CAI24EE5R35W0),Carrier,91690,Inverter ACs,2 Ton Inverter AC, 5 Star Rating | Copper Condenser | 1 Year Comprehensive Warranty, 10 Years Compressor Warranty, 5 Years PCB Warranty | For Rooms up to 260 sqft | Power Consumption: 1500 W | Refrigerant: R32 | Smart Energy Display, Follow Me, PM 2.5 Micron Filter
